{
  "name": "custom",
  "recipe_type": "custom",
  "intent": "Open reference path for user-defined computational simulation studies that do not fit a built-in recipe.",
  "description": "Open recipe for user-defined computational work. The host agent chooses tools while SimFlow provides optional evidence and safety guidance.",
  "tags": ["custom", "open_workflow", "reference_recipe"],
  "applicable_software": ["custom"],
  "stages": ["literature_review", "proposal", "modeling", "computation", "analysis_visualization", "writing"],
  "evidence_outputs": ["project_manifest", "key_file_references", "analysis_or_run_summary", "optional_handoff_summary"],
  "recommended_checks": ["stage intent documented", "inputs and outputs recorded", "scripts and commands recorded", "approval triggers reviewed", "claims traced to evidence"],
  "approval_triggers": ["real_hpc_submit", "remote_execution", "local_job_submit", "destructive_file_operation", "licensed_or_proprietary_file_handling"],
  "handoff_notes": ["Record why a custom path was chosen, which tools were used, and how each claim traces to artifacts."],
  "metadata": {"schema_version": "1.0.0"}
}
